{
  "meta": {
    "file_number": 138,
    "psychology_type": "Type_B（気づき・発見型）",
    "cta_type": "ソフトCTA",
    "euphemism": "直接表現可",
    "phase": "P5（File.121-150）：発見と蓄積の30本",
    "phase_role": "P5第18回（pkg5設計図、ブロックS4＝File.136〜140「手の動作」の3本目）。ただし『続き』『前回の』『ここからは』等の連続性・導入・区切りの扱いは一切しない。P5は各本単独完結で、前回視聴の前提なし・販売導線なし・ブロック構造は視聴者に見せない。Type_B（P5版＝数字つきの手順を本人の動作の外形として列挙する・終カットに一覧テロップ1枚・前例ep123/125/128/131/134）・ソフトCTA（caption.ctaのみ・6回目・述語の差し替えあり・前例ep123/125/128/131/134）・婉曲不要（meta.euphemismは『直接表現可』・前例ep125/127/128/129/133/134/137。悩み語を置いてよい意味ではなく、足元・靴・体の不調・対処・製品は0件）。design_master File.138のテーマ原文『タオルを干すときは、洗濯ばさみを4つ、端から留めていきます』に基づく。以下の構図1〜6を厳守する。(1)【P5段ルールとS4様式要件】冒頭1文（0〜3秒）＝テーマ文（タオルを干す情景と『4つ』）から入る（前置き・挨拶・背景説明なし）／展開＝竿にタオルをかける外形・洗濯ばさみを開く手の外形・端から順に4つはさむ位置と手の動きだけを置く（理由・はたらき・以前との比較・良し悪しを書かない）／終わり方＝同じ手つきをしている人が自分の手を重ねられる具体を1点、S4様式要件のうち『洗濯ばさみ』の系統で閉じる（指先はep136、新聞紙の音はFile.140に譲り先取りしない）／終わり方の禁止＝依頼形・二人称への要求・『〜な人に送って』・タグ付け依頼を置かない。送る相手は視聴者の頭の中にだけ浮かぶ設計で、本文に相手を書かない。(2)【テーマ由来語の解禁（本回限り）と数値】『タオル』『干す』『洗濯ばさみ』『洗濯』『4つ』『端』『留め』は本回のテーマ由来語として解禁（骨格の要所にとどめ乱用しない。『留め具』『端から留め』以外のep127/128由来語は封印継続）。『手』『指』『ベランダ』『竿』は可。『4つ』はテーマ提示部（冒頭1文・hook・サムネイル文字）のみ、番号1〜4は終カットの一覧テロップ内のみ。これ以外の新規数値0件（着地文に数値なし。ナンバリング定型『12年』『File.138』とハッシュタグ定型『#12年の記録』は除く）。★恒久ルール：本数表現（『◯本目』『30本』等）はナレーション・テロップ・caption・サムネイル文字に置かない。洗濯ばさみを『◯本』と数えない（『4つ』で置く）。時間帯の語（夜・朝）は置かない。(3)【Type_Bの4項目と純度】4項目は端から順に洗濯ばさみをはさむ位置と手の動きの外形のみ（本回：左の端／そのとなり／さらにそのとなり／右の端）。列挙ラベルはひらがなの数え『ひとつ、／ふたつ、／みっつ、／よっつ、』に限る（『一つ』の漢字表記・『1つ目』『◯番、』『1枚目』『まず／次に／最後に』『はじめに／それから／おわりに』は不可）。理由・はたらき・良し悪し・乾き方を書かない。内面独白・感情語0件。『靴』『足』は定型以外0件でタオルを靴・足元に結ばない。終カットに一覧テロップ1枚（番号1〜4＋短い語・10字以内・約物なし・最終行）。(4)【ソフトCTA（6回目）の機構とcaption本文】caption.ctaのみで行う。要件6点＝非依頼形（依頼・勧誘・疑問形の呼びかけなし）／二人称・呼びかけ・宛先指定なし／販売圧なし（購入・商品・リンクへの誘導なし、保存・フォロー・タグ付けの行動指示なし）／『プロフィール』の語はcaption.ctaに限り使用可、『DM』は全面不可／1文・静かな言い切りの事実陳述／禁止語23語幹＋prohibited_direct13語は0件、悩み語・部位・製品なし。★述語の差し替え＝『置いています』『置いてあります』『プロフィールに置』『載っています』『の記録にも』『たどれます』『でも』『から読めます』『読めます』『続いています』『届いています』を用いない（本回は『収まっています』）。主語は本回の場面（洗濯ばさみを端から留める一コマ）と結ぶ。telop_guideline.cta_expression=null。caption本文は『書き留め』『静かに』『の様子です』『残しています』『あります』『そろえます』『のばします』『じっとします』『ながめます』『決めます』『移します』『受けます』『見ていました』を用いない別の述語で場面を置く（陳述形・2文以内・悩み語なし）。ナレーション・テロップ・caption本文・サムネイル文字には誘導の気配を一切置かない。(5)【着地第42形＝留め終えた物の見え方の言い切り型】既往41型（ep96〜137。直近の着地述語は『〜てあります』『〜ました』『〜ていきます』『〜ません』『〜ます』『〜ずにおきます』『〜ておきます』『〜でした』『〜てしまいます』『〜てきます』）のいずれも用いない。第42形は、洗濯ばさみを主語に、4つ留め終えた直後の並び・間隔の見え方を現在進行『〜ています』で言い切る着地1文のみ（本回：『洗濯ばさみは、竿に沿って、間をあけて並んでいます。』）。第28形（本人主語・場所句前置）・第29形（置いた物の一部）・第30形（本人が残した痕跡）とは構造を別にする＝主語は洗濯ばさみ・場所句を文頭に置かない・『跡』『残』なし・風の描写語なし。『並べる』は不可（『並んで』は可）。列挙の終項（4つ目の動作）をそのまま着地にしない（第38形不可）。本人の次の動作を描かない（第9形不可）。『今日も』『のほう』『じっと』『もう』『つい』『まだ』『しか』『だけ』『まま』『しばらく』『これから』『覚えています』『以上』『ください』を着地に用いない。理由・評価・数値・内面語・指示語主語なし。(6)【J1・婚姻制約】登場は本人のみ。妻・子ども・家族（実家の親を除く）・同僚・友人等の名指し・気配を置かない。干すのは本人のタオルのみで、家族の洗濯物・ほかの人の衣類・同居の気配を置かない。受け手への呼びかけ・二人称は全面不可。12年＝勤務年数カノン維持（『◯年目』『◯年前』『働き始めた頃』不可・『この3年』封印）。one_messageは『タオルを干すとき、洗濯ばさみを4つ、端から留めていく一コマ』一本。【用いない語（本文系フィールド全般）】ep137再封印：夜／玄関／作業着／ポケット／裏返／砂／こぼれ／手に取り／手を入れ／粒／当たり／底をつまんで／つまん／手の上／たまる／指の間／少しずつ増え／出ます／受けます／てきます。ep136再封印：指先／靴の中／そっと／たしかめ／手に染み／染み／上がり口／靴の口／こちらを向い／添え／なぞ／ゆっくり引き／次の靴／手が移／手つき／考えるより先に／てしまい／続いています／向かう日。ep135再封印：高速／サービスエリア／車を降り／まず／風の向き／風上／風下／旗／案内板／木の枝／かたむい／雲／立つ位置／届いています／同じ向き／あいだも／風。ep134再封印：長い運転／車を停め／はじめに／それから／おわりに／道の脇／ハザード／路面／畑／ながめ／読めます。ep133再封印：仕事のあと／エンジン／ハンドル／10秒／じっと／ラジオ／しんと／からっぽ／ずにおき／ておき。ep132再封印：信号／ペダル／曲げ／のばし／ワイパー／止まっています／向こう。ep131再封印：マット／手順／広げ／打ち／こす／交互／そろえ／たどれます／次に／最後に。ep130再封印：ストーブ／冬の夜／ずしり／読んでいます。ep129再封印：上着／ファスナー／持ち手／金具／差しこ／最後まで。ep128再封印：たたんで／たたむ／鞄／1枚目／2枚目／角／折／平ら／重ね／留め具／ぱちん／奥／晩。ep127再封印：6時／マフラー／手のひら／ふわり／たらす／揺れ／整え／ポケット。ep126再封印：濡れ／雨／水たまり／しずく。ep125再封印：机／鍵／財布／帽子／水筒／ふた／◯番、形式の列挙。ep124再封印：日ざし／すそ／あおぐ。ep123再封印：1つ目／2つ目／3つ目／椅子／拭く／履く。ep121再封印：ハンガー／袖／薄手／厚手／ドアノブ。ep117以前：乾／乾かす／並べる／回数／数え／一つ／部屋／洗面所／廊下／床／空気／毎朝／朝／夜。S4〜S6先取り禁止：File.139『シャツ』『えり』『丁寧』『洗いあが』／File.140『新聞紙』『丸め』『かさかさ』『詰め』『音がします』／File.141『やかん』『3分』『いちばん静か』／File.143『カーテン』『ほこり』／File.144『深く息を吸』／File.146『コインランドリー』『膝に肘』『洗濯機』／File.147『はためい』／File.150『コンビニ』『缶を両手』『両手で包』『月』。風・天気の描写（なびく・ゆれる・はためく）は置かない。追加：DM／あなた／みなさん／してね／しましょう／本目／30本／足（定型以外全編0件）。ハッシュタグ不可：#上着／#車通勤／#マットの上／#信号待ち／#ペダルの上／#ハンドル／#仕事のあと／#長距離運転／#道の脇／#ストーブ／#冬の夜／#サービスエリア／#風の向き／#上がり口／#指先／#作業着／#ポケット／#足系／DM／プロフィール。『安全靴』はナンバリング定型とハッシュタグ定型のみ可。『プロフィール』はcaption.ctaのみ可。"
  },
  "purpose": "タオルを干すとき、洗濯ばさみを端から順に4つ留めていく手の動きを、本人の動作の外形だけで淡々と置く。留め方の理由も、はたらきも、対処も書かず、見返せる一覧を終カットに1枚置き、同じ手つきで洗濯ばさみを開く人が自分の手を思い浮かべられる具体を1点置いて閉じる。売らず、依頼せず、各本単独で完結する。",
  "target_state": "タオルを洗濯ばさみで留めたことのある視聴者が、手の動きの外形を見て自分の手に引き寄せられ、終カットの一覧を見返したくなる状態。初見の人にも予備知識は不要で、30-50代男性が、和男の日常の一コマに親近感を覚える状態。前回の視聴に頼らない。",
  "logic": [
    "タオルを干すときは、洗濯ばさみを4つ、端から留めていく、というテーマ文を冒頭で言い切る。続けて、ベランダの竿にタオルをかける、両側が同じ長さで下がる、右手の親指と人さし指で洗濯ばさみを開く、という外形を置き、ひとつ・ふたつ・みっつ・よっつの順に、左の端から右の端までをはさむ位置と手の動きだけを置く。理由・はたらき・以前との比較・良し悪しは書かない",
    "内面独白・感情語は置かない。悩み語・部位の不調・製品・靴や足元への結びつけも足さず、悩みに触れない中立の場面の外形だけを置く。登場は本人のみで、干すのは本人のタオルだけ",
    "着地は、洗濯ばさみを主語に、留め終えた直後の並びと間隔を『〜ています』で静かに言い切って閉じる（第42形）。4つ目の動作をそのまま着地にせず、次の動作・依頼・予告・誘導は本文に置かない。終カットのテロップ最終行に番号つきの一覧を1枚置く"
  ],
  "psychology": {
    "entry": "実用の入口。タオルを干す情景と『4つ』の数字から入り、順に続く手の動きが終わりに一覧になると予感させる、保存される実用形の入口",
    "exit": "もっと聞きたい。理由も結論も語らないまま、洗濯ばさみが間をあけて並ぶ見え方で言い切って終わり、終カットの一覧を見返したくなる余韻で締める。誘導は本文に一切置かない"
  },
  "narration_guideline": {
    "direction": "タオルを干す本人が、洗濯ばさみを端から順に4つ留めていく淡々とした手の描写。冒頭でテーマ文『タオルを干すときは、洗濯ばさみを4つ、端から留めていきます。』を言い切る（『4つ』は冒頭のこの1回）。続けて、ベランダの竿にタオルをかける、竿の両側に同じ長さで下がる、右手の親指と人さし指で洗濯ばさみを開く、という外形を置き、列挙ラベル『ひとつ、』『ふたつ、』『みっつ、』『よっつ、』の順に、左の端／そのとなり／さらにそのとなり／右の端をはさむ、という位置と手の動きの外形だけを置く。列挙ラベルはひらがな表記に限る。内面独白・感情語は置かない。各項目の理由・はたらき・良し悪し・以前との比較は書かない。足元・靴・体の不調・製品・他者の気配は置かない。着地は【第42形＝留め終えた物の見え方の言い切り型】『洗濯ばさみは、竿に沿って、間をあけて並んでいます。』：洗濯ばさみを主語に、留め終えた直後の並びと間隔を『〜ています』で言い切って閉じる。4つ目の動作を着地にせず、次の場面を描かず、数値・内面語・場所句前置・指示語主語・依頼形・二人称・既往41型の語を含まない。同じ手つきで洗濯ばさみを開く人が自分の手を思い浮かべられる、洗濯ばさみの系統の具体1点としてこの一文を置く。登場人物は本人のみ。語尾は全文『です・ます』。Type_Bの本回目安は170〜190字。参考例文（この通りの使用を推奨）：『タオルを干すときは、洗濯ばさみを4つ、端から留めていきます。ベランダの竿に、タオルをかけます。タオルは、竿の両側に、同じ長さで下がります。右手の親指と人さし指で、洗濯ばさみを開きます。ひとつ、左の端を、はさみます。ふたつ、そのとなりを、はさみます。みっつ、さらにそのとなりを、はさみます。よっつ、右の端を、はさみます。洗濯ばさみは、竿に沿って、間をあけて並んでいます。』",
    "key_emotion": "淡々とした落ち着き。感情を盛らず、手の位置と動きを一定の調子で順に置き、留め終えた並びの見え方で言い切って締める",
    "opening_approach": "イン・メディアス・レス。タオルを干す情景と数字を言い切るテーマ文から即座に入り、前置き・挨拶・背景の話は挟まない。導入2-3秒でテーマ提示、展開で竿にかける外形とひとつ・ふたつ・みっつ・よっつの手の動きを順に置き、着地で留め終えた洗濯ばさみの並びを言い切って閉じる3構成。",
    "pacing": "Type_B P5版。一定のテンポで外形を提示する。冒頭の句点の後に短い間を置き、竿にかける外形から、ひとつ・ふたつ・みっつ・よっつまで同じ調子で一文ずつ進める。洗濯ばさみを開く句点の後にだけ半拍の間を置き、着地の一文は言い切って余韻を残して終える。"
  },
  "telop_guideline": {
    "direction": "ナレーションを文字化せず、場面と手の動きの外形を短く視覚的に提示する5行構成。テロップは1行が1カードとして順に表示されるため、前半4行に場面・動作の短い語を置き、最終行を終カットの一覧テロップ1枚とする。最終行は1行（10字以内）の中に番号1〜4と短い語を置く（見返す動機）。番号を含むテロップはこの最終行だけにする。理由・はたらき・良し悪しを示す語を置かない。依頼形・二人称・呼びかけ・誘導（リンク・フォロー・保存・コメント・タグ付け等）はテロップに一切置かない。約物（句読点・記号）は使用しない。CTAはcaption.ctaの欄のみで担い、テロップ最終行は一覧のためcta_expressionはnullとする。構成案：タオルを干す／洗濯ばさみ／端から順に／間をあけて／1左2左中3右中4右",
    "cta_expression": null
  },
  "thumbnail_guideline": {
    "direction": "無地の暗い背景に、広く空けた静かな構図で文字だけを置く（顔・ブランド名・人物は写さない）。タオルを干すひとときの静けさを、文字まわりの広い空きで表現する。",
    "tone": "静かで淡々としたトーン、ベランダの竿の前の手もとがかすかに漂う雰囲気",
    "selected_text": [
      "タオルを干す",
      "洗濯ばさみ4つ",
      "端から順に"
    ]
  },
  "caption": {
    "hook_line": "洗濯ばさみを4つ、端から留める話です。",
    "body": "ベランダの竿にタオルをかけて、洗濯ばさみで端から順にはさみます。",
    "cta": "洗濯ばさみを端から留める一コマは、プロフィールの投稿欄に収まっています。",
    "hashtags": [
      "#安全靴",
      "#工場勤務",
      "#12年の記録",
      "#タオル",
      "#洗濯ばさみ"
    ]
  },
  "tone_and_rules": {
    "persona": "共感共闘型・和男（30代中旬・工場勤務12年・未婚・一人暮らし・足元の悩みの当事者）",
    "narration_duration": "20〜30秒。導入（2-3秒）→展開（12-20秒）→着地（3-5秒）の3構成",
    "narration_chars": "140〜200字",
    "telop_lines": "3〜6行",
    "telop_max_chars_per_line": 10,
    "sentence_ending": "です・ます",
    "prohibited_words": [
      "効",
      "治",
      "消え",
      "改善",
      "変わ",
      "変化",
      "変え",
      "解決",
      "完全",
      "劇的",
      "即効",
      "必ず",
      "絶対",
      "確実に",
      "限定",
      "今だけ",
      "残りわずか",
      "足のニオイ",
      "足が臭い",
      "悪臭",
      "臭い足",
      "足臭",
      "体臭"
    ],
    "one_message": "タオルを干すとき、洗濯ばさみを4つ、端から留めていく一コマ",
    "numbering": "安全靴と戦う12年の記録：File.138",
    "marriage_constraint": "和男は未婚。妻・子ども・家族（実家の親を除く）の話は使用禁止。人間関係は職場・友人・知人・一人暮らしの日常・内面の範囲で構成する。"
  },
  "honesty_rule": {
    "effect_claim": "効果を断定も暗示もしない。「効く」「治る」「消える」「改善する」は禁止。",
    "guarantee": "保証しない。「必ず」「絶対」「確実に」は禁止。",
    "purchase_pressure": "合わない人が買う確率を下げる設計。購入を急かす・限定感を出す表現は禁止。",
    "tone_consistency": "気にならなくなった・保証しない・よかったら。この3語のトーンを一貫する。",
    "changed_prohibition": "「変わった」は効果の暗示に近いため使用禁止。体験談は「気にならなくなった」に統一。「変わった」「変化があった」「変化を感じた」等の表現はすべて禁止。"
  },
  "euphemism_dict": {
    "prohibited_direct": [
      "足のニオイ",
      "足が臭い",
      "悪臭",
      "臭い足",
      "足臭",
      "体臭",
      "蒸れ臭",
      "雑菌",
      "腐敗臭",
      "発酵臭",
      "殺菌",
      "除菌",
      "ニオイ対策"
    ],
    "conversion_table": {
      "足のニオイ": ["足元の違和感", "足元の悩み"],
      "臭い": ["気になる", "違和感がある"],
      "体臭": ["体の内側の問題", "内側のケア"],
      "蒸れ": ["靴の中の環境", "密閉後の空気"],
      "雑菌": ["蓄積したもの", "靴の内側の問題"],
      "腐敗": ["独特の気配", "あの感覚"],
      "発酵": ["密閉の影響", "靴の中の変化"],
      "ニオイ対策": ["足元ケア", "足元と向き合う"],
      "なくな": ["気にならなくな", "落ち着く"],
      "殺菌": ["清潔にする", "環境を整える"],
      "除菌": ["靴の内側を整える"],
      "解決": ["向き合う", "試したこと"],
      "完全": ["できる範囲で", "自分なりに"],
      "劇的": ["じわじわと", "少しずつ"],
      "即効": ["じっくりと", "続けることで"]
    }
  }
}
