{
  "meta": {
    "file_number": 70,
    "psychology_type": "Type_B（気づき・発見型）",
    "cta_type": "ソフトCTA",
    "euphemism": "直接表現可",
    "phase": "前半（File.61-70）：対話の扉を開く",
    "phase_role": "P3前半、File.69（Type_A・DM誘導、会社の健康診断で足を見せる瞬間の告白）に続く回。design_master File.70のテーマ（12年の記録を見返して見えた、季節ごとの違い）に基づき、Type_Aの告白・独白からType_Bの気づき・発見型へ型を戻し、12年間書き続けてきたノート（記録）そのものを観察対象とし、そこから見えた季節ごとの違いという事実を淡々と提示する、長期記録から浮かび上がる事実提示型＝データ観察型の構図で描く。同じType_Bで『12年』を扱うFile.63（12年間で一番良かったと感じているものほど人には言いにくいという逆説を提示し、理由をあえて明かさずに終える構成）とは、対象が『一番良かったもの』という単一の抽象的な気づきではなく、『記録に書く量そのものが季節で異なる』という反復的・データ的な観察である点で骨格を分け、語彙面でも『一番』『言えない』というFile.63の中核語を用いない。同じType_BのFile.66（安全靴の中敷きを月1で交換する理由。判断基準は『沈み込み』という劣化の兆候）とも、対象が消耗品の交換基準ではなく、ノートに書く量という記録行動そのものの季節差である点で切り分け、『中敷き』『交換』『沈み込み』『月に一度』の語をいずれも用いない。健康診断という職場の一瞬の場面を扱ったFile.69とも、公的な緊張の告白ではなく、私的なノートを12年分見返すという内省的な観察作業である点で構図を反転させ、『健康診断』『靴下』の語も用いない。人間関係は私的なノートの見返しという一人暮らしの内省の範囲だけで構成する。"
  },
  "purpose": "12年分のノートを見返すと、季節によって書く量が全然違うという和男の気づきを正直に共有する。感情に訴えるのではなく、長期記録から浮かび上がった事実として提示し、季節ごとの記録に関心を持った視聴者の保存行動とプロフィールへの遷移を促す一本とする。",
  "target_state": "P1-P2を通じて和男の存在をすでに知っている視聴者は『12年記録を続けている人』として和男を認識している状態。初見の視聴者は足元の悩みを持つ30-50代男性で、長期間の記録から見えるデータ的な気づきに実用的な関心を持つ状態。いずれも直列視聴を前提にしない。",
  "logic": [
    "12年分のノートを見返すと、季節によって書く量が全然違うことに気づいた",
    "夏は靴を脱いだ後につい数行書き足す日が多く、冬は特に書くことがなく数行で終わる日がほとんどだった",
    "理由ははっきりしないが、記録の量そのものが季節を映しているという事実だけは、12年分を見返して確信した"
  ],
  "psychology": {
    "entry": "知的好奇心入口。『12年分のノートを見返すと、季節で書く量が全然違う』という記録そのものへの気づきの提示から、なぜ季節で量が違うのかという好奇心で視聴者を拾う",
    "exit": "『もっと聞きたい』着地。季節によって記録の量が違うという気づきを事実として提示し切ることで、他の季節の記録も気になるという期待を残し、保存とプロフィールへの遷移を促す"
  },
  "narration_guideline": {
    "direction": "12年分のノートを見返すと、季節によって書く量が全然違うという気づきを、感情を込めすぎず淡々と提示する気づき型の語り。前半で『季節で書く量が違う』という事実を短く提示し、中盤で夏と冬それぞれの具体的な書きぶりの違いを対比して示し、後半は理由に踏み込まず『記録の量が季節を映している』という事実の着地で締める。Type_Bの目安として160〜200字。",
    "key_emotion": "落ち着いた気づきと静かな確信。感傷的にならず、12年分の記録を見返したことで得た納得感",
    "opening_approach": "イン・メディアス・レス。『12年分のノートを見返すと』のような振り返りの提示から即座に入り、『安全靴を12年履いていて…』のような背景説明は挟まない。冒頭2-3秒で『季節で書く量が違う』というフックを置き、展開で夏と冬の書きぶりの対比、着地で記録の量が季節を映しているという事実に至る3構成。",
    "pacing": "Type_Bの一定テンポで情報提示する。前半・中盤とも句点ごとに淡々と刻み、緩急をつけすぎない。『冬は、数行で終わる日がほとんどでした。』の句点の直後にのみ短い間を置き、季節差という気づきを事実として視聴者に預けたまま終える。"
  },
  "telop_guideline": {
    "direction": "ナレーションの対比をそのまま文字化せず、『季節』『記録の量』という言葉を視覚的な軸に短く提示する。前半に気づきの事実（例：『12年分の』→『ノートを見ると』）、中盤に季節差の描写（例：『夏は数行』→『冬はわずか』）、後半にソフトCTAを配置する4〜5行構成。ナレーションと同じ動詞・同じ語順の反復は避ける。テーマ由来の禁止語幹に触れる語は使用せず、『違う』『差がある』等の言い換えで表現する。",
    "cta_expression": "季節ごとの記録はプロフィールのリンクから"
  },
  "thumbnail_guideline": {
    "direction": "積み重なった記録ノートを開いて夏のページと冬のページを見比べる構図、あるいはノートに手書きの文字量の違いが分かる手元だけを写す構図（顔は写さない）。特別な出来事ではなく、12年分の記録を淡々と見返す静かな発見の時間を、生活感のある光で表現する。",
    "tone": "落ち着いた知的好奇心、静かな発見のトーン",
    "selected_text": ["12年の記録", "季節で", "量が違う", "気づいたこと"]
  },
  "caption": {
    "hook_line": "12年分のノートを見返すと、気づいたことがあります。",
    "body": "12年分のノートを見返すと、季節によって書く量が全然違うことに気づきました。\n夏は靴を脱いだ後、つい数行書き足す日が多く、冬は特に書くことがなく数行で終わる日がほとんどです。\n理由ははっきりしませんが、記録の量そのものが季節を映しているという事実だけは、12年分を見返して確信しました。",
    "cta": "季節ごとの記録は、プロフィールにまとめています。よかったら覗いてみてください。",
    "hashtags": ["#安全靴", "#工場勤務", "#12年の記録", "#季節の記録", "#足元ケア"]
  },
  "tone_and_rules": {
    "persona": "共感共闘型・和男（30代中旬・工場勤務12年・未婚・一人暮らし・足元の悩みの当事者）",
    "narration_duration": "20〜30秒。導入（2-3秒）→展開（12-20秒）→着地（3-5秒）の3構成",
    "narration_chars": "140〜200字",
    "telop_lines": "3〜6行",
    "telop_max_chars_per_line": 10,
    "sentence_ending": "です・ます",
    "prohibited_words": [
      "効", "治", "消え", "改善", "変わ", "変化", "変え", "解決", "完全", "劇的", "即効",
      "必ず", "絶対", "確実に", "限定", "今だけ", "残りわずか",
      "足のニオイ", "足が臭い", "悪臭", "臭い足", "足臭", "体臭"
    ],
    "one_message": "12年分のノートを見返して気づいた、季節によって書く量そのものが全然違うという和男の発見",
    "numbering": "安全靴と戦う12年の記録：File.70",
    "marriage_constraint": "和男は未婚。妻・子ども・家族（実家の親を除く）の話は使用禁止。人間関係は職場・友人・知人・一人暮らしの日常・内面の範囲で構成する。"
  },
  "honesty_rule": {
    "effect_claim": "効果を断定も暗示もしない。「効く」「治る」「消える」「改善する」は禁止。",
    "guarantee": "保証しない。「必ず」「絶対」「確実に」は禁止。",
    "purchase_pressure": "合わない人が買う確率を下げる設計。購入を急かす・限定感を出す表現は禁止。",
    "tone_consistency": "気にならなくなった・保証しない・よかったら。この3語のトーンを一貫する。",
    "changed_prohibition": "「変わった」は効果の暗示に近いため使用禁止。体験談は「気にならなくなった」に統一。「変わった」「変化があった」「変化を感じた」等の表現はすべて禁止。"
  },
  "euphemism_dict": {
    "prohibited_direct": [
      "足のニオイ", "足が臭い", "悪臭", "臭い足", "足臭", "体臭",
      "蒸れ臭", "雑菌", "腐敗臭", "発酵臭", "殺菌", "除菌", "ニオイ対策"
    ],
    "conversion_table": {
      "足のニオイ": ["足元の違和感", "足元の悩み"],
      "臭い": ["気になる", "違和感がある"],
      "体臭": ["体の内側の問題", "内側のケア"],
      "蒸れ": ["靴の中の環境", "密閉後の空気"],
      "雑菌": ["蓄積したもの", "靴の内側の問題"],
      "腐敗": ["独特の気配", "あの感覚"],
      "発酵": ["密閉の影響", "靴の中の変化"],
      "ニオイ対策": ["足元ケア", "足元と向き合う"],
      "なくな": ["気にならなくな", "落ち着く"],
      "殺菌": ["清潔にする", "環境を整える"],
      "除菌": ["靴の内側を整える"],
      "解決": ["向き合う", "試したこと"],
      "完全": ["できる範囲で", "自分なりに"],
      "劇的": ["じわじわと", "少しずつ"],
      "即効": ["じっくりと", "続けることで"]
    }
  }
}
