{
  "meta": {
    "file_number": 111,
    "psychology_type": "Type_A（告白・独白型）",
    "cta_type": "DM誘導",
    "euphemism": "直接表現可",
    "phase": "後半（File.111-120）：日常を見せ、動作を一つ渡す",
    "phase_role": "P4後半（File.111-120）、pkg4設計図後半フェーズ3の初回。5段目ブロック（File.111-115）の1本目＝『主張』枠。design_master File.111のテーマ原文『作業を終えたその足で買い物に寄って帰った日のこと』に基づき、pkg4第6章の指定『時間の再配分の記録（5.3の読み替え）。直帰しなかった日の描写のみ。因果は語らない』を忠実に実装する。以下の構図を厳守する。(1)Type_Aの告白・独白型として、作業を終えてそのまま買い物に寄って帰った、ある日の場面を内面の独白で静かに描く。入口=弱さ・本音への共感、出口=『この人に話したい』（captionのDM誘導が機能する接続）、pacing=前半ゆっくり→後半静かに置く運び。Type_B・Type_Cに寄せない。一人称は『僕』。(2)【因果の遮断（最重要）】寄り道が『できた』理由・何かが良くなったこと・はたらきの示唆を一切語らない。直帰しなかった日の場面だけを置く。対策・製品への言及、体まわりへの接続、『おかげで』『〜から（理由接続）』『〜ので』等で寄り道と良さを結ぶ表現は全面不可。驚き・新鮮さ等の感情も最小限の内面記述に留め、理由の説明に進まない。(3)テーマ由来語の解禁：『作業を終え』『その足で』『買い物』『寄り道（寄って）』『帰った日』は使用可。骨格として要所に置くにとどめ、乱用しない。(4)場面の線引き：帰着後の家の場面を描かない（描写は帰り道・立ち寄りまで）。支払い・値段の話にしない。誘い・飲みの場面にしない。買う物・店の種類を名指ししない（対象無名）。接客場面を再現しない。(5)先取り禁止：File.112（就寝前・電気・減りました）、File.113（今日は早いな・同僚に言われ）、File.115（気にならなくなった）の語を用いない。(6)外部データ・一般論・他人の事例を引かない。全文過去形回想基調（テーマ提示・着地の現在形は可）。12年は勤務年数カノンとし、年数をさかのぼる表現や働き始めた頃の表現は用いない。(7)登場人物は本人のみ。妻・子ども・家族・同僚・友人・店の人等の名指し・気配を一切置かない（婚姻制約）。(8)DM誘導の純度：caption.ctaは設計図原文（pkg4 8.1）に句点を付した逐語一致とする。ナレーション・テロップにDM・プロフィール・リンク誘導を置かない。テロップ最終行にCTA文言を置かない。ハードCTAは本文・テロップで全面不可。(9)one_messageは『作業帰りにそのまま買い物へ寄った日の記録』一本。理由・はたらき・これからの話へ軸を割らない。(10)【着地構文＝第15の形（本部裁定）】『〜で、全部です。』型（総括の言い切り）。ナレーション最終文は『あの日の出来事は、帰り道と小さな袋で、全部です。』、最終テロップは『帰り道と小さな袋』。名詞を主語に立て、指示語を主語にしない。『だけ』『〜なら』『〜ようにしています』『〜たことは、ありません』を用いない。着地文にテーマ文をそのまま反復しない。因果の含みを持たせない。『一つ』はep108の封印語のため着地に用いない。以下14型はすべて回避：File.96・97『今日も、同じ〜』型／File.98『その〜は、まだ〜です』型／File.99『〜てみると、〜が伝わってきます』型／File.100『〜ないまま、〜を思っています』型／File.101『〜からです。』型／File.102冒頭文との反復クローズ型／File.103本数主語の外形言い切り型／File.104抽象主語＋動詞言い切り型／File.105人称主語の次行動描写クローズ型／File.106指示語主語の確言クローズ型／File.107『〜ようにしています』型／File.108『〜たことは、ありません』型／File.109条件節『〜なら』＋言い切り型／File.110『〜だけです。』型。(11)honesty_rule：prohibited_direct（13語）と禁止語リスト（23語・語幹部分一致）を本文・テロップ・captionに含めない。語尾は全文『です・ます』で統一する。【用いない語（本文系フィールド全般）】ep110『迷』を含む語・『棚』『基準』『短くなりました』『店』『手を伸ばす』『眺め』『ずらり』『端から端』。ep109『手間』『回数』『測る』『続けられる』『〜ようになりました』。ep108『毎朝』『引き出し』『取り出す』『家を出る』『一つ』。ep107『合う』『合わない』『条件』『はっきり』『言える』。ep106『中身』『量』『選ぶ』『最初に見る』。ep105『休憩室』『外の空気』『癖』『戻る』。ep104『前提』『数え』『多いほど』『止まり』。ep103『小瓶』『使いかけ』『捨て』。ep102『根性』『信じていた』『説明』『手近』。ep101『外側』『手入れ』『目に見え』『12年前の僕』。ep100『100本目』『通し番号』『読んでいる人』『顔が浮かぶ』。ep99『削られた』『手帳』『予定』『真っ白』。ep98『半歩』『並んで歩く』『歩幅』『背中』『追いつ』。ep97『洗面所』『床』『バケツ』『同じ場所』『12年ずっと』。ep96『窓』『順番』『いつのまにか』『帰宅』『靴を脱ぐ』『家に着く』。ep95『120本』『見取り図』『先に言っておきます』。ep94『夕方』『電車』『席』『立っている』『思い出せません』『気づけば』。ep93『通じる』『通じない』『優劣』『ただ線がある』。File.112/113/115先取り『就寝前』『電気』『減りました』『今日は早いな』『同僚に言われ』『気にならなくなった』。既往場面語：帰省・実家・緊張・見せたことがある・店員・聞かれたくない・買い替え・金額・出費・足し上げ・消したい回・読み返す・新しい同僚・同じ悩み・意味あるの・同僚の問い・根拠・先輩・退職・調べる習慣・結婚式・革靴・あの緊張感・健康診断・靴下・金曜・誘い・座敷・断る・正直に言います・片づく・片づかない・朝5時半・玄関・足を入れる・十数秒・休日・並べる・乾かす・ルーティン。"
  },
  "purpose": "『作業を終えたその足で買い物に寄って帰った日』の場面を、理由も良し悪しも語らないまま、自分の内面の独白として静かに開示し、DM誘導『そのまま寄り道して帰った日がある人、いますか。』へcaptionで自然に接続する。pkg4設計図後半フェーズ3・5段目ブロック（File.111-115）の1本目＝『主張』枠として、時間の再配分の記録を直帰しなかった日の描写のみで示す。",
  "target_state": "P1-P4を通じて和男の存在をすでに知っている視聴者は、日常の細部と内面の両方に触れ続けている状態。初見の視聴者は足元の悩みを持つ30-50代男性で、和男の記録が自分の日常に近いかどうかを見ている途中の状態。いずれも直列視聴を想定しない。",
  "logic": [
    "作業を終えて、その足で買い物に寄って帰った日のこと、とテーマを静かに提示する（理由・良し悪しは語らない）",
    "いつもの帰り道とは違う方へ曲がり、通路をゆっくり歩き、袋を片手に歩いて帰った、という場面の外形のみを過去形回想で中立的に置く。因果や製品・対策には接続しない",
    "着地は、あの日の出来事を名詞を主語にして『帰り道と小さな袋で、全部です』と総括の言い切りで静かに閉じる"
  ],
  "psychology": {
    "entry": "弱さ・本音への共感入口。直帰しなかった日の自分を、理由を添えないまま静かに開示する",
    "exit": "『この人に話したい』着地。因果には触れず、帰り道と小さな袋という最小の事実で静かに閉じ、captionのDM誘導『そのまま寄り道して帰った日がある人、いますか。』へ自然に接続する"
  },
  "narration_guideline": {
    "direction": "作業を終えてそのまま買い物に寄って帰った日の場面を、独白として静かに語る。冒頭で『作業を終えて、その足で買い物に寄って帰った日のことです。』とテーマを提示し、中盤で曲がった先の通路・外の明るさ・袋を片手に歩いた帰り道を、過去形で中立的に描写する。寄り道ができた理由、良くなったこと、はたらきの示唆は一切語らない。接続は並置にとどめ、理由を結ぶ接続表現を使わない。帰着後の家の場面は描かない。買う物・場所の種類・人物は置かない。着地は『あの日の出来事は、帰り道と小さな袋で、全部です。』という総括の言い切りで締める第15の形（『〜で、全部です。』型）。名詞を主語に立て、指示語を主語にしない。着地文にテーマ文を反復しない。登場人物は本人のみ。語尾は全文『です・ます』、一人称は『僕』（本文では省略可）。Type_Aの目安として140〜170字。参考例文（この通りの使用を推奨）：『作業を終えて、その足で買い物に寄って帰った日のことです。出口で、いつもの帰り道とは違う方へ、ふっと曲がりました。通路をゆっくり歩いて、特に何も探していませんでした。外はまだ明るくて、空気が少し広く感じられました。袋を片手に、のんびり歩いて帰りました。あの日の出来事は、帰り道と小さな袋で、全部です。』",
    "key_emotion": "直帰しなかった日を、理由を添えず静かに思い返している感覚",
    "opening_approach": "イン・メディアス・レス。テーマの提示から即座に入り、背景の語りは挟まない。冒頭2-3秒で直帰しなかった日というフックを置き、展開で曲がった先の場面を重ね、着地で総括の言い切りに至る3構成。",
    "pacing": "Type_Aの前半ゆっくり→後半静かに置く運び。冒頭の提示はゆっくり運ぶ。『ふっと曲がりました。』の句点の後に短い間を置き、『空気が少し広く感じられました。』の句点の後にもう一段静かな間を置く。着地の『あの日の出来事は、帰り道と小さな袋で、全部です。』は最も静かなトーンに落とし、声を絞るように終える。"
  },
  "telop_guideline": {
    "direction": "ナレーションの独白をそのまま文字化せず、『作業を終えて』『買い物』『明るい空』『帰り道と小さな袋』を視覚的な軸に短く提示する4行構成。前半に作業を終えたという状態、中盤に買い物へ寄った場面と外の明るさ、最終行に総括の短い言い切り（cta_expression）を置く。最終行はCTA文言ではなく事実陳述とする。読者への動作の要求・依頼・二人称の呼びかけ・プロフィール/リンク/DM言及はテロップに一切置かない（DM誘導はcaption.ctaのみ）。約物は使用しない。理由や良し悪しを示す語はテロップに置かない。構成案：作業を終えて／その足で買い物へ／まだ明るい空／帰り道と小さな袋",
    "cta_expression": "帰り道と小さな袋"
  },
  "thumbnail_guideline": {
    "direction": "手元の袋と足元の帰り道のみを写す構図（顔・商品名・ラベルの文字は写さない）。直帰しなかった日の静けさを、袋を持つ手元と地面という一部分のみで表現する。",
    "tone": "静かで内省的なトーン、ゆっくり歩く様子",
    "selected_text": [
      "作業を終えて",
      "その足で",
      "買い物へ"
    ]
  },
  "caption": {
    "hook_line": "作業を終えて、その足で買い物に寄って帰った日のことです。",
    "body": "まだ明るい帰り道を、ゆっくり歩いた日がありました。",
    "cta": "そのまま寄り道して帰った日がある人、いますか。",
    "hashtags": [
      "#安全靴",
      "#工場勤務",
      "#12年の記録",
      "#帰り道",
      "#買い物"
    ]
  },
  "tone_and_rules": {
    "persona": "共感共闘型・和男（30代中旬・工場勤務12年・未婚・一人暮らし・足元の悩みの当事者）",
    "narration_duration": "20〜30秒。導入（2-3秒）→展開（12-20秒）→着地（3-5秒）の3構成",
    "narration_chars": "140〜200字",
    "telop_lines": "3〜6行",
    "telop_max_chars_per_line": 10,
    "sentence_ending": "です・ます",
    "prohibited_words": [
      "効",
      "治",
      "消え",
      "改善",
      "変わ",
      "変化",
      "変え",
      "解決",
      "完全",
      "劇的",
      "即効",
      "必ず",
      "絶対",
      "確実に",
      "限定",
      "今だけ",
      "残りわずか",
      "足のニオイ",
      "足が臭い",
      "悪臭",
      "臭い足",
      "足臭",
      "体臭"
    ],
    "one_message": "作業帰りにそのまま買い物へ寄った日の記録",
    "numbering": "安全靴と戦う12年の記録：File.111",
    "marriage_constraint": "和男は未婚。妻・子ども・家族（実家の親を除く）の話は使用禁止。人間関係は職場・友人・知人・一人暮らしの日常・内面の範囲で構成する。"
  },
  "honesty_rule": {
    "effect_claim": "効果を断定も暗示もしない。「効く」「治る」「消える」「改善する」は禁止。",
    "guarantee": "保証しない。「必ず」「絶対」「確実に」は禁止。",
    "purchase_pressure": "合わない人が買う確率を下げる設計。購入を急かす・限定感を出す表現は禁止。",
    "tone_consistency": "気にならなくなった・保証しない・よかったら。この3語のトーンを一貫する。",
    "changed_prohibition": "「変わった」は効果の暗示に近いため使用禁止。体験談は「気にならなくなった」に統一。「変わった」「変化があった」「変化を感じた」等の表現はすべて禁止。"
  },
  "euphemism_dict": {
    "prohibited_direct": [
      "足のニオイ",
      "足が臭い",
      "悪臭",
      "臭い足",
      "足臭",
      "体臭",
      "蒸れ臭",
      "雑菌",
      "腐敗臭",
      "発酵臭",
      "殺菌",
      "除菌",
      "ニオイ対策"
    ],
    "conversion_table": {
      "足のニオイ": [
        "足元の違和感",
        "足元の悩み"
      ],
      "臭い": [
        "気になる",
        "違和感がある"
      ],
      "体臭": [
        "体の内側の問題",
        "内側のケア"
      ],
      "蒸れ": [
        "靴の中の環境",
        "密閉後の空気"
      ],
      "雑菌": [
        "蓄積したもの",
        "靴の内側の問題"
      ],
      "腐敗": [
        "独特の気配",
        "あの感覚"
      ],
      "発酵": [
        "密閉の影響",
        "靴の中の変化"
      ],
      "ニオイ対策": [
        "足元ケア",
        "足元と向き合う"
      ],
      "なくな": [
        "気にならなくな",
        "落ち着く"
      ],
      "殺菌": [
        "清潔にする",
        "環境を整える"
      ],
      "除菌": [
        "靴の内側を整える"
      ],
      "解決": [
        "向き合う",
        "試したこと"
      ],
      "完全": [
        "できる範囲で",
        "自分なりに"
      ],
      "劇的": [
        "じわじわと",
        "少しずつ"
      ],
      "即効": [
        "じっくりと",
        "続けることで"
      ]
    }
  }
}
