{
  "meta": {
    "file_number": 69,
    "psychology_type": "Type_A（告白・独白型）",
    "cta_type": "DM誘導",
    "euphemism": "健康診断で靴下を脱いで足元を人前にさらす数秒間の緊張感",
    "phase": "前半（File.61-70）：対話の扉を開く",
    "phase_role": "P3前半、File.67（Type_A・CTAなし、金曜の夜の飲み会を座敷と知って断った回避判断の独白）・File.68（Type_C・CTAなし、靴下を3足まとめ買いする日常スケッチ）に続く回。design_master File.69のテーマ『会社の健康診断で足を見せる瞬間の話』に基づき、Type_Aの告白・独白へ型を戻し、design図7.1のDM誘導CTAバリエーション表に明記された『これ、伝わる人にだけ伝わると思う。DMで教えてください』を用いるv3初のDM誘導回とする。同じType_Aで会社関連の場面を扱うFile.62（後輩の入社をきっかけにした距離・視線への戸惑い、婉曲要・CTAなし）とは、出来事の性質を『新しい人間関係が生む持続的な緊張』から『年に一度の公的な検査で足を見せる一瞬の緊張』へ切り替え、語彙面でも『後輩』『距離』『視線』を用いない。File.65（Type_A・DM誘導、同僚の一言をきっかけにした『気にならなくなった』という安堵の自覚）とは、CTA種別は同じDM誘導ながら、他者の発言を起点にする受け身の告白ではなく、和男自身が毎年迎える『見せる瞬間』という一場面への集中で構図を切り替え、『同僚』『言われた』『気にならなくなった』の語も用いない。File.67（座敷のある店だと知って行く前に断るという回避判断、CTAなし）とは、回避できる社会的な誘いではなく、避けられない公的な義務（健康診断）である点で構図を反転させ、『金曜』『誘い』『座敷』『断る』の語も用いない。健康診断という職場の場面が出るが、職場の人間関係や家族の話には転じさせず、靴下を脱いで足を見せる数秒間の内心だけに焦点を絞る。婉曲要のため、euphemism_dictのprohibited_directに沿い、直接表現は一切用いず『あの数秒』『足元を見せる瞬間』のような婉曲描写に徹する。"
  },
  "purpose": "年に一度、会社の健康診断で靴下を脱いで足を見せる順番が回ってくる、その数秒間だけ心のどこかで身構えてしまうという和男の告白を共有する。避けられない公的な場面での言葉にしにくい緊張という高い共感度を軸に、DM誘導『これ、伝わる人にだけ伝わると思う。DMで教えてください』へ自然に接続し、P3前半でのDM発生を狙う一本とする。",
  "target_state": "P1-P2を通じて和男の存在をすでに知っている視聴者は『12年記録を続けている人』として和男を認識している状態。初見の視聴者は足元の悩みを持つ30-50代男性で、会社の健康診断という誰もが経験する場面に馴染みがある状態。いずれも直列視聴を前提にしない。",
  "logic": [
    "年に一度の健康診断で、靴下を脱いで足を見せる順番が回ってくる瞬間、他の検査項目とは違う緊張が静かに湧き上がる",
    "看護師や医師から何か言われたことは一度もないが、その数秒だけ、心のどこかで身構えてしまう",
    "終わればいつも通りの一日に戻るが、来年もまた同じ数秒が来ることは分かっている"
  ],
  "psychology": {
    "entry": "弱さ・本音への共感入口。年に一度の健康診断で靴下を脱いで足を見せる、誰もが経験しうる公的な場面での言葉にしにくい緊張の開示から、視聴者の共感を拾う",
    "exit": "『この人に話したい』着地。特別な言葉を足さず、毎年同じ数秒を静かに迎え続けているという告白の余韻を残し、DM誘導『これ、伝わる人にだけ伝わると思う。DMで教えてください』へ自然に接続する"
  },
  "narration_guideline": {
    "direction": "年に一度の健康診断で、名前を呼ばれて靴下を脱ぐよう促される瞬間を独白として語る。他の検査項目では感じない緊張が、その数秒だけ静かに湧き上がることを、直接的な言葉を使わずに描写する。前半は診察室で靴下を脱ぐよう促される場面をゆっくり辿り、後半はその数秒をやり過ごした後の静けさと、来年も同じ数秒が来るという事実を置く。Type_Aの目安として140〜170字。",
    "key_emotion": "緊張とかすかな身構え、毎年同じ数秒を迎える諦めに近い受容",
    "opening_approach": "イン・メディアス・レス。『健康診断で、靴下を脱いでくださいと言われた瞬間』のような場面の提示から即座に入り、背景説明は挟まない。冒頭2-3秒で健康診断の場面というフックを置き、展開でその数秒への身構え、着地で来年もまた同じ数秒が来るという事実に至る3構成。",
    "pacing": "Type_Aの前半ゆっくり→後半沈黙のテンポ。前半（名前を呼ばれ靴下を脱ぐ場面）は事実を追うゆっくりとしたテンポ。『その数秒だけ、心のどこかで身構えていました』のような一文を境に後半へ移り、着地までは間を意識したテンポにする。着地の句点の直後に最も長い間を置き、静けさを視聴者に残してCTAへ接続する。"
  },
  "telop_guideline": {
    "direction": "ナレーションの独白をそのまま文字化せず、『健康診断』『靴下』という言葉を視覚的な軸に短く提示する。前半に場面の事実（例：『年に一度の』→『健康診断』）、中盤に心の動き（例：『靴下を脱ぐ』→『その数秒だけ』）、後半にCTAを配置する4〜5行構成。ナレーションと同じ動詞・同じ語順の反復は避ける。",
    "cta_expression": "これ、伝わる人にだけ伝わると思う。DMで教えてください"
  },
  "thumbnail_guideline": {
    "direction": "健康診断の待合室や診察室を思わせる床、脱いだ靴下と靴を横に置いた足元のカット（顔は写さない）。特別な出来事ではなく、年に一度決まって訪れる場面での静かな緊張感を、生活感のある光で表現する。",
    "tone": "静かな緊張感、生活感のあるリアルなトーン",
    "selected_text": ["健康診断", "靴下を脱ぐ", "あの数秒", "毎年来る"]
  },
  "caption": {
    "hook_line": "会社の健康診断で、毎年同じ数秒があります。",
    "body": "靴下を脱いで、足を見せる順番が回ってくる瞬間です。\n他の検査項目では感じない緊張が、その数秒だけ静かに湧き上がります。\n誰かに何か言われたことは一度もありません。ただ、自分だけが身構えているのかもしれません。",
    "cta": "同じ数秒に覚えがあるなら、DMでひとこと送ってください。",
    "hashtags": ["#安全靴", "#工場勤務", "#12年の記録", "#健康診断", "#足元の悩み"]
  },
  "tone_and_rules": {
    "persona": "共感共闘型・和男（30代中旬・工場勤務12年・未婚・一人暮らし・足元の悩みの当事者）",
    "narration_duration": "20〜30秒。導入（2-3秒）→展開（12-20秒）→着地（3-5秒）の3構成",
    "narration_chars": "140〜200字",
    "telop_lines": "3〜6行",
    "telop_max_chars_per_line": 10,
    "sentence_ending": "です・ます",
    "prohibited_words": [
      "効", "治", "消え", "改善", "変わ", "変化", "変え", "解決", "完全", "劇的", "即効",
      "必ず", "絶対", "確実に", "限定", "今だけ", "残りわずか",
      "足のニオイ", "足が臭い", "悪臭", "臭い足", "足臭", "体臭"
    ],
    "one_message": "会社の健康診断で靴下を脱いで足を見せる瞬間、他の検査項目にはない緊張が毎年静かに湧き上がるという和男の告白",
    "numbering": "安全靴と戦う12年の記録：File.69",
    "marriage_constraint": "和男は未婚。妻・子ども・家族（実家の親を除く）の話は使用禁止。人間関係は職場・友人・知人・一人暮らしの日常・内面の範囲で構成する。"
  },
  "honesty_rule": {
    "effect_claim": "効果を断定も暗示もしない。「効く」「治る」「消える」「改善する」は禁止。",
    "guarantee": "保証しない。「必ず」「絶対」「確実に」は禁止。",
    "purchase_pressure": "合わない人が買う確率を下げる設計。購入を急かす・限定感を出す表現は禁止。",
    "tone_consistency": "気にならなくなった・保証しない・よかったら。この3語のトーンを一貫する。",
    "changed_prohibition": "「変わった」は効果の暗示に近いため使用禁止。体験談は「気にならなくなった」に統一。「変わった」「変化があった」「変化を感じた」等の表現はすべて禁止。"
  },
  "euphemism_dict": {
    "prohibited_direct": [
      "足のニオイ", "足が臭い", "悪臭", "臭い足", "足臭", "体臭",
      "蒸れ臭", "雑菌", "腐敗臭", "発酵臭", "殺菌", "除菌", "ニオイ対策"
    ],
    "conversion_table": {
      "足のニオイ": ["足元の違和感", "足元の悩み"],
      "臭い": ["気になる", "違和感がある"],
      "体臭": ["体の内側の問題", "内側のケア"],
      "蒸れ": ["靴の中の環境", "密閉後の空気"],
      "雑菌": ["蓄積したもの", "靴の内側の問題"],
      "腐敗": ["独特の気配", "あの感覚"],
      "発酵": ["密閉の影響", "靴の中の変化"],
      "ニオイ対策": ["足元ケア", "足元と向き合う"],
      "なくな": ["気にならなくな", "落ち着く"],
      "殺菌": ["清潔にする", "環境を整える"],
      "除菌": ["靴の内側を整える"],
      "解決": ["向き合う", "試したこと"],
      "完全": ["できる範囲で", "自分なりに"],
      "劇的": ["じわじわと", "少しずつ"],
      "即効": ["じっくりと", "続けることで"]
    }
  }
}
