{
  "meta": {
    "file_number": 136,
    "psychology_type": "Type_A（告白・独白型）",
    "cta_type": "DM誘導",
    "euphemism": "足元の違和感",
    "phase": "P5（File.121-150）：発見と蓄積の30本",
    "phase_role": "P5第16回（pkg5設計図、ブロックS4＝File.136〜140「手の動作」の1本目）。ただし『新しい系統の始まり』『後半』『区切り』の扱いは一切しない。P5は各本単独完結で、前回視聴の前提なし・販売導線なし・ブロック構造は視聴者に見せない。Type_A（P5版＝場面と身体動作から入り、内面は一行だけ添える・前例ep121/124/126/129/130/133/135）・DM誘導（caption.ctaのみ・6回目・述語の差し替えあり）・婉曲要（meta.euphemismは核『足元の違和感』・最小接触方式の線引き再設計回）。design_master File.136のテーマ原文『指先を靴の中に入れて、そっとたしかめる動きが、手に染みついています』に基づく。以下の構図1〜6を厳守する。(1)【P5段ルールとS4様式要件】冒頭1文（0〜3秒）＝靴が手元にある家の情景から入る（前置き・挨拶・背景説明なし・数値なし・内面語なし）／展開＝指先を靴の口から入れる外形・なぞる・添える・止める・引く外形・次の靴へ手が移る外形・上がり口の外形だけを順に置く（理由・中身・結果・はたらき・以前との比較を書かない）／終わり方＝同じ手つきの人が自分の手を重ねられる具体を1点、S4様式要件『指先』の系統で閉じる（洗濯ばさみはFile.138、新聞紙はFile.140に譲り先取りしない）／終わり方の禁止＝依頼形・二人称への要求・『〜な人に送って』・タグ付け依頼を置かない。送る相手は視聴者の頭の中にだけ浮かぶ設計で、本文に相手を書かない。(2)【テーマ由来語の解禁（本回限り）と数値】『指先』『靴の中』『そっと』『たしかめ』『手に染み』は本回のテーマ由来語として解禁（骨格の要所にとどめ乱用しない。『そっと』はナレーション側のみでCTAには用いない）。『指先が縮む』『縮む』は封印継続。『靴』『手』『指』は常用語として可。新規数値0件（ナンバリング定型『12年』『File.136』とハッシュタグ定型『#12年の記録』は除く）。本数表現は置かない（恒久ルール）。(3)【婉曲要＝最小接触方式（線引き再設計）と内面一行】可＝指先を靴の口から入れる・なぞる・添える・止める・引く・次の靴へ手が移る、という本人の手の動作の外形のみ／靴が手元にある家の外形（上がり口・靴を置く場所・光）。不可＝たしかめる理由・たしかめる中身（湿り・温度・におい・小石など）・たしかめた結果の判定・靴の内側の様子・足の感覚語／部位／状態・製品・道具・以前との比較・『そっと』の理由。『足』の語は全編0件（『指先』の所属は『手』で示す）。靴を脱ぐ・履くの描写は置かない（靴がすでに手元にある情景から始める）。Type_A内面一行は全編で一行のみ・展開部後半・冒頭と着地には置かない・足元／靴／たしかめる中身／理由に触れない中立の一文。『〜かな、という気もします』『気が重い』『と思います』『と思っています』『感じます』『気もします』『からっぽ』『静か』『気分』は不可。感情語の連打なし。ナレーション140〜200字（本回の目安170〜190字）・です・ます調統一。(4)【DM誘導CTA（6回目）の機構とcaption本文】caption.ctaのみで行う。要件6点＝非依頼形（依頼・勧誘形なし、疑問形の呼びかけなし）／二人称・呼びかけ・宛先指定なし／販売圧なし（購入・商品・リンク・保存・フォロー・タグ付けの行動指示なし）／『DM』の語はcaption.ctaに限り使用可（ナレーション・テロップ・caption本文・hook_line・ハッシュタグには置かない）、『プロフィール』の語は全面不可／1文・静かな言い切り（DMを受け付けている側の事実陳述）／禁止語23語幹とprohibited_direct13語は0件、CTAにも悩み語・部位・製品・理由を置かない。★述語の差し替え＝『受け取っています』『そっと』『◯の話は』『開いています』『読んでいます』『届いています』『あいだも』、およびソフトCTA側の『置いています』『載っています』『たどれます』『から読めます』を用いず、主語は本回の場面（手の動作・上がり口）と結ぶ。CTAに『靴』『指先』『たしかめ』を置かない。ナレーション・テロップ・caption本文・サムネイル文字には誘導の気配を一切置かない（E3対象）。telop_guideline.cta_expression=null。caption本文（body）は『書き留め』『静かに』『の様子です』『残しています』『あります』『そろえます』『のばします』『じっとします』『ながめます』『決めます』『見ていました』を用いない別の述語で場面を置く（陳述形・依頼形なし・2文以内・悩み語なし・たしかめる理由と中身を書かない）。(5)【着地第40形＝意図に先んじる動作の言い切り型】既往39型（今日も同じ型／まだ型／伝わってきます型／ないまま型／からです型／反復クローズ型／本数主語型／抽象主語型／次行動描写型／指示語確言型／〜ようにしています型／〜たことはありません型／条件節なら型／だけです型／全部です型／ままです型／覚えています型／のほうです型／これからです型／以上です型／〜てから〜ます型／条件節＋依頼の言い切り型／状態の言い切り『〜になりました』型／思いの言い切り『〜と思っています』型／身体反応の言い切り型／視覚情景の言い切り型／聴覚情景の言い切り型／居場所と光の受けの言い切り型／置いた物の位置の言い切り型／残った跡の言い切り型／物の様子の名詞述語言い切り『〜です』型／支度の結果状態の言い切り『〜てあります』型／動作完了の言い切り『〜ました』型／時間の経過の言い切り『〜ていきます』型／現在否定の言い切り『〜ません』型／視界の人工物の言い切り『〜ます』型／保留の言い切り『〜ずにおきます』型／列挙の終項の言い切り『〜ます』型／観察結果の言い切り『〜でした』型）のいずれも用いない。直近の着地述語『〜ています』『〜です』『〜てあります』『〜ました』『〜ていきます』『〜ません』『〜ます』『〜ずにおきます』『〜ておきます』『〜でした』で閉じない。第40形は、本人の指先を主語に、考えるより先に手が動く様子を『〜てしまいます』で静かに言い切る着地1文のみ。後悔語（つい・また・やはり・どうしても・気づくと）を添えない／『今日も』『今日は』『のほう』を用いない／理由と判断を書かない／場所句前置なし／自然物主語・指示語主語にしない／数値・内面語を置かない／着地に『もう』『もう片方』『まだ』『しか』『だけ』『まま』『しばらく』『じっと』『になります』を用いない（『次の靴』『片方の靴』で置く）。(6)【J1・婚姻制約】登場は本人のみ。妻・子ども・家族（実家の親を除く）・同僚・友人等の名指し・気配を置かない。家の場面でも家族の靴・ほかの人の靴・同居の気配を置かない（並ぶ靴は本人の靴のみ）。受け手への呼びかけ・二人称は全面不可。12年＝勤務年数カノン維持。one_messageは『指先を靴の中に入れて、そっとたしかめる手の動きが染みついている一コマ』一本。【用いない語（本文系フィールド全般）】ep135再封印：高速／サービスエリア／車を降り／まず／風の向き／風上／風下／見てとった／自動販売機／旗／案内板／木の枝／かたむい／雲／手をかざ／かざし／立つ位置／走行音／遠くまで来た／届いています／広く開け／山の上／駐車場／顔を向け／同じ向き／あいだも。手と靴の描写で出やすい封印語：指を動か／曲げ／のばし／反対の靴／靴そのもの／つま先／中敷き／かかと／ひも／奥／靴を手に持／持ち上げ／履く／履き／靴の表面／乾かす／乾／癖／並べる／床／鍵／膝の上／箱のふた／そろえ／押さえ／重ね／端／整え／向きをそろえ。ep134〜ep121の再封印（長い運転／車を停め／ハンドル／じっと／信号／ペダル／マット／ストーブ／上着／タオル／鞄／マフラー／ポケット／水たまり／肌寒い／日ざし／椅子／ベンチ／ドアノブ／ハンガー／ためらい／もう一枚）を継続。S4〜S5先取り禁止：砂／作業着／ポケット／裏返す／こぼれ／洗濯ばさみ／干す／留め／シャツ／えり／たたむ／丁寧／新聞紙／丸め／かさかさ／詰め／やかん／3分／カーテン／ほこり／深く息を吸／コインランドリー／膝に肘／はためい／コンビニ／缶を両手／両手で包／月。ep101以前の既往場面語（外側／手入れ／休日／ルーティン／靴下／同じ悩み 等）も用いない。『安全靴』はナンバリング定型とハッシュタグ定型のみ可。『足』は全編0件。"
  },
  "purpose": "上がり口で靴を前に、指先を靴の中に入れてそっとたしかめる一コマを、本人の手の動作の外形だけで静かに置く。たしかめる理由も中身も結果も、対処も書かず、内面は理由に触れない中立のひとことを添えるだけにとどめ、同じ手つきの人が自分の指先を思い浮かべられる具体を1点置いて閉じる。売らず、依頼せず、各本単独で完結する。",
  "target_state": "靴を前にして同じ手つきをしている視聴者が、上がり口で指先を靴の中に入れる外形を見て自分の手に引き寄せられ、和男の独白をもう少し聞いてみたくなる状態。初見でも予備知識は不要で、30-50代男性が、和男の日常の一コマに親近感を覚える状態。前回の視聴に頼らない。",
  "logic": [
    "上がり口の靴の情景から入り、靴の口に指先を添える、なぞる、靴の中に入れる、そっとたしかめる、引く、次の靴へ手が移る、という手の動作の外形だけを順に置く。たしかめる理由・中身・結果・以前との比較・対処は書かない",
    "内面は展開部の後半に一文だけ置く。足元にも靴にも理由にも触れない中立のひとことにとどめ、他の感情語や内面文は足さない。悩みに触れない手の動作の外形だけで、足元の違和感に場面の側から間接的に触れる",
    "着地は、本人の指先を主語に、考えるより先に手が動く様子を『〜てしまいます』で静かに言い切って閉じる（第40形）。本人の次の動作・依頼・予告・誘導・数値は本文に置かない"
  ],
  "psychology": {
    "entry": "弱さ・本音への共感。上がり口の靴の情景と、靴の口に指先を添えて入れる手の外形から入り、飾らない独白が始まると予感させる入口",
    "exit": "この人に話したい。理由も結論も語らないまま、考えるより先に手が動くことを言い切って終わり、同じ手つきの人の指先が静かに思い浮かぶ余韻で締める。誘導は本文に一切置かない"
  },
  "narration_guideline": {
    "direction": "上がり口に靴が見える場面から、本人が靴の口に指先を添えて入れ、そっとたしかめる淡々とした独白。冒頭でテーマ提示『上がり口に、靴が見えます。』と情景から入る。展開は、靴の口が向いている向き、指先を添える、靴の口をなぞる、靴の中に入れる、そっとたしかめる、ゆっくり引く、次の靴の口へ手が移る、入れて・たしかめて・引く、という手の動作の外形だけを置く。たしかめる理由・中身・結果・はたらき・以前との比較・対処は書かない。身体の感覚語・部位・状態・靴の内側の様子・製品・道具は名指し・示唆しない。内面は展開部後半に『口にすると、少し照れくさい動きです。』の一文のみを置く（理由に触れない中立の一文。他の感情語・内面文は足さない。冒頭と着地に内面語を置かない）。続けて『この手つきは、手に染みついています。』でテーマの核を置く。着地は【第40形＝意図に先んじる動作の言い切り型】『考えるより先に、指先が次の靴の中に入ってしまいます。』：本人の指先を主語に、考えるより先に手が動く様子を『〜てしまいます』で言い切って閉じる。後悔語・理由と判断・場所句前置・指示語主語・数値・内面語・依頼形・二人称・既往39型の語を含まない。同じ手つきの人が自分の指先を思い浮かべられる具体1点（指先が次の靴に入る）としてこの一文を置く。登場人物は本人のみ。語尾は全文『です・ます』。本回の目安は170〜190字。参考例文（この通りの使用を推奨・全角184字）：『上がり口に、靴が見えます。靴の口は、こちらを向いています。靴の口に、指先を添えます。指先で、靴の口をなぞります。指先を、靴の中に入れます。そっと、たしかめます。指先を、ゆっくり引きます。次の靴の口へ、手が移ります。入れて、たしかめて、引きます。口にすると、少し照れくさい動きです。この手つきは、手に染みついています。考えるより先に、指先が次の靴の中に入ってしまいます。』",
    "key_emotion": "淡々とした落ち着き。感情を盛らず、指先を入れてたしかめる手の外形を一定の調子で置き、手が先に動くことを言い切って静かに閉じる",
    "opening_approach": "イン・メディアス・レス。上がり口に靴が見える情景を言い切る一文から即座に入り、前置き・挨拶・背景の話は挟まない。導入2-3秒でテーマ提示、展開で指先を入れてたしかめる手の外形を順に置き、着地で手が先に動くことを一点置いて閉じる3構成。",
    "pacing": "Type_A P5版。前半はゆっくり、場面と手の動作を一文ずつ置く。そっとたしかめるの句点の後に短い間を置き、次の靴へ手が移る句点の後でさらに間を取る。内面の一文は低く置き、その句点の後に沈黙を挟んでから、着地の一文を静かに言い切って終える。"
  },
  "telop_guideline": {
    "direction": "ナレーションを文字化せず、場面と手の動作の外形を短く視覚的に提示する5行構成。テロップは1行が1カードとして順に表示されるため、前半から後半へ、場所・指先の動き・靴の中・たしかめる・次の靴の順に短い語を置く。内面語・理由・はたらき・良し悪しを示す語は置かない。依頼形・二人称・呼びかけ・誘導（リンク・フォロー・保存・コメント・タグ付け等）はテロップに一切置かない。約物（句読点・記号）は使用しない。番号は置かない（一覧テロップ不要）。CTAはcaption.ctaの欄のみで担い、cta_expressionはnullとする。構成案：上がり口の靴／指先を添える／靴の中に入れる／そっとたしかめる／次の靴へ手が移る",
    "cta_expression": null
  },
  "thumbnail_guideline": {
    "direction": "無地の暗い背景に、広く空けた静かな構図で文字だけを置く（顔・ブランド名・人物は写さない）。上がり口の静けさを、文字まわりの広い空きで表現する。",
    "tone": "静かで淡々としたトーン、上がり口の明かりがかすかに漂う雰囲気",
    "selected_text": [
      "上がり口",
      "指先"
    ]
  },
  "caption": {
    "hook_line": "上がり口の話です。",
    "body": "靴の口に指先を添えて、次の靴へ手を移します。",
    "cta": "手が上がり口に向かう日も、DMの受付は続いています。",
    "hashtags": [
      "#安全靴",
      "#工場勤務",
      "#12年の記録",
      "#上がり口",
      "#指先"
    ]
  },
  "tone_and_rules": {
    "persona": "共感共闘型・和男（30代中旬・工場勤務12年・未婚・一人暮らし・足元の悩みの当事者）",
    "narration_duration": "20〜30秒。導入（2-3秒）→展開（12-20秒）→着地（3-5秒）の3構成",
    "narration_chars": "140〜200字",
    "telop_lines": "3〜6行",
    "telop_max_chars_per_line": 10,
    "sentence_ending": "です・ます",
    "prohibited_words": [
      "効",
      "治",
      "消え",
      "改善",
      "変わ",
      "変化",
      "変え",
      "解決",
      "完全",
      "劇的",
      "即効",
      "必ず",
      "絶対",
      "確実に",
      "限定",
      "今だけ",
      "残りわずか",
      "足のニオイ",
      "足が臭い",
      "悪臭",
      "臭い足",
      "足臭",
      "体臭"
    ],
    "one_message": "指先を靴の中に入れて、そっとたしかめる手の動きが染みついている一コマ",
    "numbering": "安全靴と戦う12年の記録：File.136",
    "marriage_constraint": "和男は未婚。妻・子ども・家族（実家の親を除く）の話は使用禁止。人間関係は職場・友人・知人・一人暮らしの日常・内面の範囲で構成する。"
  },
  "honesty_rule": {
    "effect_claim": "効果を断定も暗示もしない。「効く」「治る」「消える」「改善する」は禁止。",
    "guarantee": "保証しない。「必ず」「絶対」「確実に」は禁止。",
    "purchase_pressure": "合わない人が買う確率を下げる設計。購入を急かす・限定感を出す表現は禁止。",
    "tone_consistency": "気にならなくなった・保証しない・よかったら。この3語のトーンを一貫する。",
    "changed_prohibition": "「変わった」は効果の暗示に近いため使用禁止。体験談は「気にならなくなった」に統一。「変わった」「変化があった」「変化を感じた」等の表現はすべて禁止。"
  },
  "euphemism_dict": {
    "prohibited_direct": [
      "足のニオイ",
      "足が臭い",
      "悪臭",
      "臭い足",
      "足臭",
      "体臭",
      "蒸れ臭",
      "雑菌",
      "腐敗臭",
      "発酵臭",
      "殺菌",
      "除菌",
      "ニオイ対策"
    ],
    "conversion_table": {
      "足のニオイ": ["足元の違和感", "足元の悩み"],
      "臭い": ["気になる", "違和感がある"],
      "体臭": ["体の内側の問題", "内側のケア"],
      "蒸れ": ["靴の中の環境", "密閉後の空気"],
      "雑菌": ["蓄積したもの", "靴の内側の問題"],
      "腐敗": ["独特の気配", "あの感覚"],
      "発酵": ["密閉の影響", "靴の中の変化"],
      "ニオイ対策": ["足元ケア", "足元と向き合う"],
      "なくな": ["気にならなくな", "落ち着く"],
      "殺菌": ["清潔にする", "環境を整える"],
      "除菌": ["靴の内側を整える"],
      "解決": ["向き合う", "試したこと"],
      "完全": ["できる範囲で", "自分なりに"],
      "劇的": ["じわじわと", "少しずつ"],
      "即効": ["じっくりと", "続けることで"]
    }
  }
}
