{
  "meta": {
    "file_number": 105,
    "psychology_type": "Type_A（告白・独白型）",
    "cta_type": "DM誘導",
    "euphemism": "休憩室に入る前に、一度外に出て、それから戻るという行動の外形（扉の手前で足を止める間合い・外に出ている時間の長さ・戻ってきた時の様子）だけで構成する婉曲の核。外の空気に当たる目的・理由、何を確かめているか、何を気にしているかはいずれも言語化しない。休憩室の中の様子・同僚の存在・視線への言及もしない。行動の外形描写と、その行動が今も続いているという事実だけで場面を閉じる。",
    "phase": "中盤（File.101-110）：前提を書き換え、基準を出す",
    "phase_role": "P4中盤（File.101-110）、pkg4設計図中盤フェーズ2（前提を書き換え、基準を出す）3段目ブロック（File.101-105）の5本目＝『橋渡し』枠（最終回）。design_master File.105のテーマ原文『休憩室に入る前、一度外の空気に当たってから戻る癖がありました』に基づき、職場での行動の癖を言い切らないまま4段目へ橋渡しする回とする。以下の構図を厳守する。(1)Type_Aの告白・独白型として、休憩室に入る前に一度外に出て外の空気に当たってから戻るという職場での小さな行動の癖を、一人称の静かな独白として開示する。入口=弱さ・本音への共感、出口=『この人に話したい』。Type_Bの気づき整理・Type_Cの一点描写に寄せない。一人称は『僕』。(2)テーマ由来語の使用可：『休憩室』『外の空気』『戻る』『癖』はテーマ文言由来のため使用可。骨格として要所に置くにとどめ、乱用しない。(3)★『癖』の特例（本回のみ）：①ep94のその他の切り分け語（夕方・電車・席・立っている・思い出せません・気づけば）は不使用とする（『癖』自体はテーマ由来として本回に限り使用可）。②通勤・移動・車内の文脈は一切持ち込まない。本回は職場・休憩室前の行動の癖だけを扱う。③『癖』は本文中で必要最小限にとどめ、連発しない。(4)婉曲:要の実装（本回の要点）：外の空気に当たる目的・理由、何を確かめているか、何を気にしているかはいずれも言語化しない。行動の外形（扉の手前で足を止める間合い・外に出ている時間の長さ・戻ってきた時の様子）の描写に徹する。休憩室の中の様子・同僚の存在・視線への言及も一切しない。(5)『言い切らずに4段目へ』の実装（最重要）：なぜそうするのかという理由・説明・自己分析・結論で閉じない。4段目File.106以降の先取り（『中身』『量』『選ぶ』『最初に見る』『基準』）は一切用いない。行動の描写と、その行動が続いているという事実の提示までで止める。(6)3段目原則『否定しない』の実装：その癖を持つ自分を責めない・笑わない・恥じない・直すべきものとして扱わない。(7)登場人物は本人のみ。同僚・上司・他者の名指し・気配を一切置かない（休憩室の中の様子・他人の視線にも触れない）。(8)DM誘導の純度：caption.ctaはpkg4設計図8.1のFile.105該当行原文＋句点『職場で同じことをしている人がいたら、聞かせてください。』を採用し、DMへの言及・依頼形・勧誘形はcaption.ctaのみに置く。ハードCTAはテロップ全面不可。telop_guideline.cta_expressionは、テロップの実質最終行となる短い事実陳述の一行（10字以内・約物なし・DM/プロフィール言及なし・依頼形/勧誘形/二人称呼びかけなし）にとどめ、誘導形にしない（File.102・104の扱いに準ずる）。(9)癖を対策・製品・結果の話に接続しない。良い結果への因果・暗示を置かない。【着地構文の別形化（本部指示・恒久・第9の形）】File.96・97の『今日も、同じ〜』型、File.98の『その〜は、まだ〜です』型、File.99の『〜てみると、〜が伝わってきます』型、File.100の『〜ないまま、〜を思っています』型、File.101の『〜からです。』型、File.102の冒頭文との反復クローズ型、File.103の本数主語の外形言い切り型、File.104の抽象主語＋動詞言い切り型、いずれとも異なる着地とする。本回の着地は『それから戻って、何ごともなかったように、また働き始めます。』という、理由を述べず・反復クローズにせず・本数や抽象主語の言い切りにもせず、戻った後の次の行動をそのまま描写することで静かに閉じる、新しい第9の型（人称主語による次の行動描写クローズ型）とする。【直近epとの切り分け語（すべて用いない）】File.104『前提』『数え』『多いほど』『止まり』。File.103『小瓶』『棚』『使いかけ』『捨て』。File.102『根性』『信じていた』『説明』『手近』。File.101『外側』『手入れ』『目に見え』『12年前の僕』。File.100『100本目』『通し番号』『読んでいる人』『顔が浮かぶ』。File.99『削られた』『回数』『手帳』『予定』『真っ白』。File.98『半歩』『並んで歩く』『歩幅』『背中』『追いつ』。File.97『洗面所』『床』『バケツ』『同じ場所』『12年ずっと』。File.96『窓』『順番』『いつのまにか』『帰宅』『靴を脱ぐ』『家に着く』。File.95『120本』『見取り図』『先に言っておきます』。File.94『夕方』『電車』『席』『立っている』『思い出せません』『気づけば』。File.93『通じる』『通じない』『優劣』『ただ線がある』。File.92『朝5時半』『玄関』『足を入れる』『十数秒』。【4段目の先取り禁止】File.106以降で用いる『中身』『量』『選ぶ』『最初に見る』『基準』は本回で一切用いない。【既往の場面の語（すべて用いない）】『帰省』『実家』『緊張』『見せたことがある』『安全靴の棚』『店員』『聞かれたくない』『買い替え』『金額』『出費』『足し上げ』『消したい回』『読み返す』『新しい同僚』『同じ悩み』『意味あるの』『同僚の問い』『根拠』『先輩』『退職』『調べる習慣』『結婚式』『革靴』『あの緊張感』『健康診断』『靴下』『金曜』『誘い』『座敷』『断る』『正直に言います』『片づく』『片づかない』『休日』『並べる』『乾かす』『ルーティン』はいずれも用いない。【honesty_rule上の注意】prohibited_direct（13語）と禁止語リスト（23語）は本文・テロップ・caption、および本phase_role等の方針文の一般語にも混入させない（語幹部分一致に注意）。癖を対策・製品を良い結果に結びつける因果・暗示に接続しない。honesty_rule.changed_prohibitionに定める禁止表現群は使用しない。語尾は全文『です・ます』で統一する。一人称は『僕』とする。EMダッシュ・三点リーダーは使用しない。【婚姻制約】登場人物は本人のみ。妻・子ども・家族（実家の親を除く）の登場・示唆は一切置かない。"
  },
  "purpose": "『休憩室に入る前に、一度だけ外に出て、外の空気に当たってから戻る』という、理由を語らない職場での行動の癖を、責めず・説明せず静かに開示し、DM誘導『職場で同じことをしている人がいたら、聞かせてください。』へcaptionで自然に接続する。pkg4設計図中盤フェーズ2・3段目ブロック（File.101-105）の5本目＝『橋渡し』枠として、職場での行動の癖を言い切らないまま4段目（File.106以降の基準の提示）へ静かに橋渡しする。",
  "target_state": "P1-P3を通じて和男の存在をすでに知っている視聴者は、File.91の宛先の宣言からFile.104の前提を疑い始めた場面までを経て、和男の日常の細部と内面の両方に触れ続けている状態。初見の視聴者は足元の悩みを持つ30-50代男性で、まだ和男の記録が自分に通じるかどうかを判断していない状態。いずれも直列視聴を前提にしない。",
  "logic": [
    "休憩室に入る前に、一度だけ外に出て外の空気に当たってから戻るという行動を、理由を説明せず提示する",
    "その行動を特別なこととして扱わず、日々の中でただ繰り返してきた癖として、責めず・恥じず描写する",
    "着地は、戻った後にまた何ごともなく働き始めるという次の行動を示すことで、理由を言い切らないまま静かに閉じる"
  ],
  "psychology": {
    "entry": "弱さ・本音への共感入口。休憩室に入る前に一度外に出て外の空気に当たってから戻るという、誰にも話したことのない小さな行動を静かに開示するところから入る",
    "exit": "『この人に話したい』着地。理由を語らないまま、その行動が今も続いているという事実だけを残し、captionのDM誘導『職場で同じことをしている人がいたら、聞かせてください。』へ自然に接続する"
  },
  "narration_guideline": {
    "direction": "休憩室に入る前に一度だけ外に出て、外の空気に当たってから戻るという行動の癖を、独白として静かに語る。前半で『休憩室に入る前に、一度だけ外に出て、外の空気に当たってから戻る。そんな癖が、僕にはずっとありました。』という開示を短く提示し、中盤で『誰かに理由を話したことは一度もありません。扉の取っ手に手をかけたところで、体だけが先に、外へ向かうだけです。』と、理由を語らないまま行動そのものだけを描写する。過去も今もその癖を責めない・笑わない・恥じない・直すべきものとして扱わない。休憩室の中の様子・同僚の存在・視線への言及は一切しない。4段目File.106以降で扱う『中身』『量』『選ぶ』『最初に見る』『基準』は一切先取りしない。なぜそうするのかという理由・自己分析・結論は述べない。着地は『少し外に立って、息をしてから戻り、何ごともなかったように、また働き始めます。』という、戻った後の次の行動をそのまま描写して静かに閉じる、新しい着地の型（第9の形）で締める（File.96・97の『今日も、同じ〜』型、File.98の『その〜は、まだ〜です』型、File.99の『〜てみると、〜が伝わってきます』型、File.100の『〜ないまま、〜を思っています』型、File.101の『〜からです。』型、File.102の冒頭文との反復クローズ型、File.103の本数主語の外形言い切り型、File.104の抽象主語＋動詞言い切り型、いずれとも異なる着地とする）。テーマ由来語『休憩室』『外の空気』『戻る』『癖』は使用可。File.104（前提・数え・多いほど・止まり）、File.103（小瓶・棚・使いかけ・捨て）、File.102（根性・信じていた・説明・手近）、File.101（外側・手入れ・目に見え・12年前の僕）の語彙・構文は用いない。通勤・移動・車内の文脈は持ち込まない。登場人物は本人のみとし、家族・同僚・友人等の名指し・気配は置かない。語尾は全文『です・ます』で統一する。一人称は『僕』とする。Type_Aの目安として140〜170字を目安としつつ、上限・下限への張り付きを狙わず内容に必要な分量で自然に収める。参考例文（この通りの使用を推奨）：『休憩室に入る前に、一度だけ外に出て、外の空気に当たってから戻る。そんな癖が、僕にはずっとありました。誰かに理由を話したことは一度もありません。扉の取っ手に手をかけたところで、体だけが先に、外へ向かうだけです。少し外に立って、息をしてから戻り、何ごともなかったように、また働き始めます。』",
    "key_emotion": "誰にも話したことのない小さな行動を静かに抱えている感覚",
    "opening_approach": "イン・メディアス・レス。『休憩室に入る前に、一度だけ外に出て、外の空気に当たってから戻る。』という行動の提示から即座に入り、背景説明は挟まない。冒頭2-3秒で行動の提示というフックを置き、展開で理由を語らないまま行動そのものを重ね、着地で戻った後の次の行動描写に至る3構成。",
    "pacing": "Type_Aの前半ゆっくり→後半沈黙のテンポ。前半（『休憩室に入る前に、一度だけ外に出て、外の空気に当たってから戻る。そんな癖が、僕にはずっとありました。』の提示）はゆっくりとしたテンポで運ぶ。『誰かに理由を話したことは一度もありません。』の句点の後に短い間を置き、『体だけが先に、外へ向かうだけです。』の句点の後に沈黙に近い長い間を置いて、理由を語らない静けさを体感させる。着地の『少し外に立って、息をしてから戻り、何ごともなかったように、また働き始めます。』は最も長い沈黙で静かに終える。"
  },
  "telop_guideline": {
    "direction": "ナレーションの独白をそのまま文字化せず、『休憩室』『外に出る』『外の空気』『戻る』を視覚的な軸に短く提示する4行構成。前半に場面の提示（例：『休憩室の前で』）、中盤に行動の明示（例：『外に出る』『外の空気に当たる』）を配置し、最終行に理由を言わないまま行動が続いていることを閉じる短い事実陳述の一行（cta_expression）を置く。最終行は『今日も』で始めず、『その〜は、まだ〜です』型・『〜てみると、〜が伝わってきます』型・『〜ないまま、〜を思っています』型・『〜からです』型・冒頭文との反復クローズ型・本数主語の外形言い切り型・抽象主語＋動詞言い切り型のいずれも用いない。読者への動作の要求・依頼・二人称の呼びかけ・プロフィール/リンク/DM言及はテロップに一切置かない（DM誘導はcaption.ctaのみに置く）。約物（句読点・記号）は使用しない。休憩室の中の様子・同僚の存在・視線は描かない。外の空気に当たる目的・理由は書かない。File.104（前提・数え・多いほど・止まり）、File.103（小瓶・棚・使いかけ・捨て）、File.102（根性・信じていた・説明・手近）、File.101（外側・手入れ・目に見え・12年前の僕）、File.100（100本目・通し番号・読んでいる人・顔が浮かぶ）、File.99（削られた・回数・手帳・予定・真っ白）、File.98（半歩・並んで歩く・歩幅・背中・追いつ）、File.97（洗面所・床・バケツ・同じ場所・12年ずっと）、File.96（窓・順番・いつのまにか・帰宅・靴を脱ぐ・家に着く）、File.95（120本・見取り図・先に言っておきます）、File.94（夕方・電車・席・立っている・思い出せません・気づけば）、File.93（通じる・通じない・優劣・ただ線がある）の語彙は用いない。",
    "cta_expression": "外に出てから戻る"
  },
  "thumbnail_guideline": {
    "direction": "休憩室に入る前、扉の手前で一瞬足を止め、外に出ていく後ろ姿を写す構図（顔・商品名は写さない）。外の空気に当たってから戻るという行動の一場面だけを、後ろ姿と扉という一部分で表現する。",
    "tone": "静かで内省的なトーン、行動の理由を語らないまま行動そのものだけを見せる落ち着き",
    "selected_text": ["外に出る癖", "戻る前に", "休憩室の前", "外の空気"]
  },
  "caption": {
    "hook_line": "休憩室に入る前に、一度だけ外に出る癖がありました。",
    "body": "理由を誰かに聞かれたことはありません。扉の前まで来ると、体が先に、外へ向かうだけです。それから戻って、何ごともなかったように、また働き始めます。",
    "cta": "職場で同じことをしている人がいたら、聞かせてください。",
    "hashtags": ["#安全靴", "#工場勤務", "#12年の記録", "#休憩室の癖", "#外の空気"]
  },
  "tone_and_rules": {
    "persona": "共感共闘型・和男（30代中旬・工場勤務12年・未婚・一人暮らし・足元の悩みの当事者）",
    "narration_duration": "20〜30秒。導入（2-3秒）→展開（12-20秒）→着地（3-5秒）の3構成",
    "narration_chars": "140〜200字",
    "telop_lines": "3〜6行",
    "telop_max_chars_per_line": 10,
    "sentence_ending": "です・ます",
    "prohibited_words": [
      "効",
      "治",
      "消え",
      "改善",
      "変わ",
      "変化",
      "変え",
      "解決",
      "完全",
      "劇的",
      "即効",
      "必ず",
      "絶対",
      "確実に",
      "限定",
      "今だけ",
      "残りわずか",
      "足のニオイ",
      "足が臭い",
      "悪臭",
      "臭い足",
      "足臭",
      "体臭"
    ],
    "one_message": "休憩室に入る前に一度外に出て、外の空気に当たってから戻るという癖を、理由を語らないまま静かに続けている和男の日常",
    "numbering": "安全靴と戦う12年の記録：File.105",
    "marriage_constraint": "和男は未婚。妻・子ども・家族（実家の親を除く）の話は使用禁止。人間関係は職場・友人・知人・一人暮らしの日常・内面の範囲で構成する。"
  },
  "honesty_rule": {
    "effect_claim": "効果を断定も暗示もしない。「効く」「治る」「消える」「改善する」は禁止。",
    "guarantee": "保証しない。「必ず」「絶対」「確実に」は禁止。",
    "purchase_pressure": "合わない人が買う確率を下げる設計。購入を急かす・限定感を出す表現は禁止。",
    "tone_consistency": "気にならなくなった・保証しない・よかったら。この3語のトーンを一貫する。",
    "changed_prohibition": "「変わった」は効果の暗示に近いため使用禁止。体験談は「気にならなくなった」に統一。「変わった」「変化があった」「変化を感じた」等の表現はすべて禁止。"
  },
  "euphemism_dict": {
    "prohibited_direct": [
      "足のニオイ",
      "足が臭い",
      "悪臭",
      "臭い足",
      "足臭",
      "体臭",
      "蒸れ臭",
      "雑菌",
      "腐敗臭",
      "発酵臭",
      "殺菌",
      "除菌",
      "ニオイ対策"
    ],
    "conversion_table": {
      "足のニオイ": ["足元の違和感", "足元の悩み"],
      "臭い": ["気になる", "違和感がある"],
      "体臭": ["体の内側の問題", "内側のケア"],
      "蒸れ": ["靴の中の環境", "密閉後の空気"],
      "雑菌": ["蓄積したもの", "靴の内側の問題"],
      "腐敗": ["独特の気配", "あの感覚"],
      "発酵": ["密閉の影響", "靴の中の変化"],
      "ニオイ対策": ["足元ケア", "足元と向き合う"],
      "なくな": ["気にならなくな", "落ち着く"],
      "殺菌": ["清潔にする", "環境を整える"],
      "除菌": ["靴の内側を整える"],
      "解決": ["向き合う", "試したこと"],
      "完全": ["できる範囲で", "自分なりに"],
      "劇的": ["じわじわと", "少しずつ"],
      "即効": ["じっくりと", "続けることで"]
    }
  }
}
